commit	accuracy	size_mb	status	description
d65b284	0.6128	1.962	discard	baseline mlp_dim=128 head_dim=64 (over 1MB cap)
b59120f	0.6110	0.837	keep	head_dim 64->16 inner_dim 256->64 first under 1MB
594ff66	0.6151	0.931	keep	mlp_dim 128->160 more FFN capacity
7b9f4bc	0.6297	0.931	keep	heads 4->8 head_dim 16->8 same inner_dim more diversity
3b2032d	0.6159	0.979	discard	mlp_dim 160->176 no improvement over 8-head config
b8c4d30	0.6128	0.931	discard	dropout 0.1->0.0 worse dropout helps
b5de4b6	0.6314	0.933	keep	attn_dropout 0.1 after softmax in myAttention
a8fe5d1	0.6320	0.933	keep	heads 8->16 head_dim 8->4 inner_dim=64 max diversity
afe5934	0.6366	0.971	keep	7 layers mlp_dim 160->128 depth beats width
3edbcfc	0.6409	0.979	keep	8 layers mlp_dim=96 depth trend continues
8ce84f1	0.6242	0.979	discard	dropout 0.05 worse 0.1 is optimal
bb48959	0.6359	0.954	discard	9 layers mlp_dim=64 too thin FFN hurts
0d21e5e	0.6345	0.979	discard	attn_dropout 0.05 worse 0.1 is optimal
0761828	0.6365	0.989	discard	9 layers mlp_dim=72 still worse than 8 layers
495d634	0.6411	0.979	keep	8 heads head_dim=8 marginally better than 16 in 8-layer
0055cb7	0.6330	0.981	discard	FFN internal dropout 0.1 over-regularizes
e015752	0.6411	0.979	discard	attn_dropout 0.15 no improvement over 0.1
541b863	0.6278	0.978	discard	head_dim 10 mlp_dim 64 trading FFN for attn hurts
4337809	0.6297	0.981	discard	learnable temperature hurts stability
91ff9ef	0.6329	0.977	discard	removing final LN hurts need it
115023a	0.6281	0.979	discard	post-LN worse pre-LN is correct
d912c32	0.6184	0.979	discard	attn_dropout=0 clearly needed
11d21d9	0.6299	0.979	discard	graduated mlp_dim 112-80 worse than uniform 96
54e62c7	0.6323	0.979	discard	graduated dropout 0.0125->0.1 worse than uniform 0.1
57c845b	0.5968	0.989	discard	LN on attn output before residual collapses training
7030f20	0.6379	0.979	discard	stochastic depth p=0.1 layer-level skip worse than neuron dropout
a15701a	0.6403	0.987	discard	QKV bias=True adds 1536 params no improvement
f660c13	0.6294	0.979	discard	parallel attn+FFN GPT-J style worse sequential wins
a934728	0.6449	0.979	keep	GPT-2 std=0.02 init for attention QKV+out new best
3d7e0e8	0.6434	0.979	discard	FFN init std=0.02 worse Kaiming better for ReLU
d3514fa	0.6310	0.979	discard	attention init std=0.01 too small
7584000	0.6401	0.979	discard	scaled output proj init 0.005 worse symmetric 0.02 better
b289afa	0.6434	0.979	discard	attn_dropout=0.12 worse 0.1 still optimal with new init
1090154	0.6370	0.979	discard	transformer dropout=0.05 worse 0.1 optimal with new init
2a0801f	0.6464	0.971	keep	7 layers mlp=128 std=0.02 init new best smaller too
fe4fb38	0.6447	0.933	discard	6 layers mlp=160 too shallow 7L is sweet spot
85614dd	0.6422	0.985	discard	7L mlp=132 wider FFN worse 128 is peak
d57812a	0.6425	0.972	discard	7L heads=16 head_dim=4 same inner_dim worse than 8 heads
96329a2	0.6384	0.972	discard	head_dim=7 inner=56 mlp=144 trades attn for FFN hurts
f698874	0.6387	0.972	discard	stochastic depth p=0.1 + 7L worse neuron dropout better
0777c31	0.6508	0.972	keep	7L mlp=128 attn_dropout=0.15 massive jump new best
d09faed	0.6430	0.972	discard	attn_dropout=0.2 too aggressive 0.15 is better
f667a53	0.6390	0.972	discard	attn_dropout=0.175 worse 0.15 is optimal
67764e3	0.6467	0.972	discard	both dropout=0.15 worse asymmetric attn=0.15 trans=0.1 wins
8c5f16c	0.6511	0.972	keep	7L mlp=128 attn=0.15 trans=0.05 asymmetric dropout wins
6ae6ab8	0.6404	0.972	discard	trans_dropout=0 too little 0.05 is optimal
ff7d7ca	0.6484	0.985	discard	7L mlp=132 attn=0.15 trans=0.05 128 still optimal
b46ce5b	0.6489	0.933	discard	6L mlp=160 attn=0.15 trans=0.05 7L still better
23ae6b2	0.6466	0.979	discard	8L attn=0.15 trans=0.05 better than 8L before but worse than 7L
88d1f1a	0.6490	0.979	discard	7L QKV bias worse even with optimal dropout
431d87d	0.6522	0.972	keep	7L heads=16 head_dim=4 attn=0.15 trans=0.05 synergy wins
2bb8449	0.6357	0.972	discard	heads=32 head_dim=2 too extreme attention too coarse
aba9c99	0.6526	0.972	keep	7L heads=16 attn=0.20 trans=0.05 synergy continues
1fc9bed	0.6466	0.972	discard	attn_dropout=0.25 too much 0.20 is peak for 16 heads
e 5 7 2 c 7 6 	 0 . 6 3 9 7 	 0 . 9 7 2 	 d i s c a r d 	 t r a n s _ d r o p o u t = 0 . 0 2   w o r s e   0 . 0 5   i s   o p t i m a l   f o r   1 6   h e a d s  
 c d 9 7 b 7 9 	 0 . 6 5 9 9 	 0 . 9 7 2 	 k e e p 	 7 L   h e a d s = 1 6   a t t n = 0 . 2 2   t r a n s = 0 . 0 5   n e w   b e s t   m a s s i v e   j u m p  
 7 6 4 5 f 9 a 	 0 . 6 5 3 8 	 0 . 9 7 2 	 d i s c a r d 	 a t t n _ d r o p o u t = 0 . 2 3   w o r s e   0 . 2 2   i s   t h e   p e a k  
 b 4 f 4 9 4 d 	 0 . 6 5 0 9 	 0 . 9 7 2 	 d i s c a r d 	 a t t n _ d r o p o u t = 0 . 2 1   w o r s e   0 . 2 2   i s   c o n f i r m e d   p e a k  
 3 9 b 4 3 f e 	 0 . 6 4 1 1 	 0 . 9 7 2 	 d i s c a r d 	 a s y m m e t r i c   d r o p 1 = 0 . 0 3   d r o p 2 = 0 . 0 7   w o r s e   s y m m e t r i c   0 . 0 5   w i n s  
 0 4 5 a 0 4 7 	 0 . 6 5 6 3 	 0 . 9 7 2 	 d i s c a r d 	 a s y m m e t r i c   d r o p 1 = 0 . 0 7   d r o p 2 = 0 . 0 3   w o r s e   s y m m e t r i c   0 . 0 5   o p t i m a l  
 2 6 7 6 2 f c 	 0 . 6 7 5 2 	 0 . 9 7 2 	 k e e p 	 e m b e d d i n g   i n i t   s t d = 0 . 0 2   + 1 . 5 3 p p   n e w   b e s t  
 d f 3 2 1 8 2 	 0 . 6 7 0 9 	 0 . 9 7 6 	 d i s c a r d 	 L a y e r S c a l e   g a m m a = 0 . 1   t o o   s m a l l   w o r s e   t h a n   n o   L S  
 f 6 2 f 1 d 0 	 0 . 6 6 4 5 	 0 . 9 7 6 	 d i s c a r d 	 L a y e r S c a l e   g a m m a = 1 . 0   w o r s e   d r o p   L a y e r S c a l e   e n t i r e l y  
 6 a 9 6 e b d 	 0 . 6 7 0 3 	 0 . 9 7 2 	 d i s c a r d 	 m l p _ h e a d   i n i t   s t d = 0 . 0 2   w o r s e   c l a s s i f i e r   n e e d s   l a r g e r   i n i t  
 2 4 6 1 5 a b 	 0 . 6 7 5 9 	 0 . 9 7 5 	 k e e p 	 8 L   m l p = 9 6   + 0 . 0 7 p p   d e p t h   h e l p s   w i t h   e m b e d d i n g   f i x  
 d d 9 2 6 d 4 	 0 . 6 8 4 2 	 0 . 9 8 6 	 k e e p 	 9 L   m l p = 7 2   + 0 . 8 3 p p   d e p t h   s c a l i n g   h u g e   j u m p  
 1 4 c 0 0 9 c 	 0 . 6 8 0 5 	 0 . 9 7 4 	 d i s c a r d 	 1 0 L   m l p = 4 8   F F N   t o o   n a r r o w   9 L   s w e e t   s p o t  
 7 9 3 0 9 8 3 	 0 . 6 7 3 6 	 0 . 9 8 6 	 d i s c a r d 	 a t t n _ d r o p o u t = 0 . 2 5   a t   9 L   t o o   m u c h  
 d f 8 9 8 1 e 	 0 . 6 6 6 4 	 0 . 9 8 6 	 d i s c a r d 	 a t t n _ d r o p o u t = 0 . 1 8   a t   9 L   t o o   l i t t l e   0 . 2 2   s t i l l   o p t i m a l  
 7 f a 0 2 6 7 	 0 . 6 4 8 5 	 0 . 9 8 6 	 d i s c a r d 	 h e a d s = 8   h d = 8   a t   9 L   w o r s e   h e a d s = 1 6   w i n s  
 3 f d 6 2 a 0 	 0 . 6 6 8 5 	 0 . 9 8 6 	 d i s c a r d 	 t r a n s = 0 . 0 3   a t   9 L   t o o   l i t t l e   0 . 0 5   s t i l l   o p t i m a l  
 f e b c 1 f e 	 0 . 6 7 5 1 	 0 . 9 8 6 	 d i s c a r d 	 t r a n s = 0 . 0 8   a t   9 L   t o o   m u c h   0 . 0 5   c o n f i r m e d   o p t i m a l  
 7 a c a e 6 8 	 0 . 6 6 7 3 	 0 . 9 8 6 	 d i s c a r d 	 C L S   l a y e r - w i s e   a g g r e g a t i o n   h u r t s   ( e a r l y   l a y e r s   a d d   n o i s e )  
 a b b e 4 2 0 	 0 . 6 7 0 0 	 0 . 9 8 6 	 d i s c a r d 	 F F N   s e c o n d   l i n e a r   s t d = 0 . 0 2   h u r t s   R e L U   o u t p u t   n e e d s   K a i m i n g  
 e 4 3 5 6 f f 	 0 . 6 7 5 8 	 0 . 9 8 6 	 d i s c a r d 	 D r o p P a t h   l i n e a r   0 - 0 . 1 0   w o r s e   t h a n   c o n s t a n t   n n . D r o p o u t ( 0 . 0 5 )  
 f 9 3 3 a 0 7 	 0 . 6 8 2 8 	 0 . 9 0 6 	 d i s c a r d 	 1 0 L   p a i r - s h a r e d   F F N   m l p = 7 2   ( - 0 . 1 4 p p   f r o m   9 L   u n s h a r e d   s h a r i n g   h a s   c o s t )  
 c 0 3 d 8 a 3 	 0 . 6 8 0 9 	 0 . 9 8 6 	 d i s c a r d 	 z e r o - i n i t   t o _ o u t   w o r s e   ( 1 0   e p o c h s   c a n t   a f f o r d   s l o w   s t a r t )  
 1 d f 6 5 9 6 	 0 . 6 7 2 0 	 0 . 9 4 5 	 d i s c a r d 	 1 0 L   p a i r - s h a r e   m l p = 8 8   w i d e r   F F N   d o e s n t   c o m p e n s a t e   s h a r i n g   c o s t  
 e 1 b 1 d 5 0 	 0 . 6 5 5 1 	 0 . 8 8 9 	 d i s c a r d 	 h i d d e n _ d i m = 4 8   1 1 L   t o o   n a r r o w   h i d d e n _ d i m = 6 4   i s   c r i t i c a l  
 9 6 0 2 4 3 6 	 0 . 6 7 3 0 	 0 . 9 8 6 	 d i s c a r d 	 2 D   s i n u s o i d a l   p o s   i n i t   h u r t s   r a n d o m   s t d = 0 . 0 2   i s   o p t i m a l  
 d 0 a 0 d 3 d 	 0 . 6 7 4 9 	 0 . 9 8 6 	 d i s c a r d 	 e m b e d d i n g   s t d = 0 . 0 1   t o o   s m a l l   0 . 0 2   i s   s w e e t   s p o t  
 f b 9 1 e 5 e 	 0 . 6 7 4 9 	 0 . 9 8 6 	 d i s c a r d 	 l a y e r - w i s e   a t t n   d r o p o u t   s c h e d u l e   0 . 1 5 - 0 . 3 0   w o r s e   u n i f o r m   0 . 2 2   w i n s  
 3 a 5 5 f a 1 	 0 . 6 7 4 3 	 0 . 9 8 6 	 d i s c a r d 	 c l s _ t o k e n   s t d = 0 . 0 0 5   s e p a r a t e   f r o m   p o s   w o r s e   u n i f o r m   0 . 0 2   w i n s  
 0 2 5 2 2 c 9 	 0 . 6 7 3 3 	 0 . 9 8 6 	 d i s c a r d 	 a t t n _ d r o p o u t = 0 . 2 0   a t   9 L   w o r s e   0 . 2 2   i s   p r e c i s e   o p t i m u m  
 a a 2 b a 9 6 	 0 . 6 7 2 3 	 0 . 9 8 6 	 d i s c a r d 	 p e r - h e a d   l e a r n a b l e   t e m p e r a t u r e   h u r t s   i n   1 0 - e p o c h   r e g i m e  
 c 5 f 5 3 5 9 	 0 . 6 6 7 6 	 1 . 0 1 0 	 d i s c a r d 	 p a r a l l e l   d u a l   F F N   O V E R   1 M B   c a p   A N D   w o r s e   d o u b l e   f a i l  
 7 2 e 7 3 f 0 	 0 . 6 6 8 4 	 0 . 8 8 0 	 d i s c a r d 	 9 L   m l p = 4 8   n a r r o w e r   F F N   h u r t s   7 2   i s   o p t i m a l   w i d t h   a t   9 L  
 1 d d d 9 a 2 	 0 . 6 5 9 2 	 0 . 5 8 3 	 d i s c a r d 	 5 L   m l p = 7 2   t o o   s h a l l o w   c a p a c i t y - c o n s t r a i n e d   n o t   o v e r f i t  
 e 8 3 e 1 b e 	 0 . 6 7 7 9 	 0 . 9 8 6 	 d i s c a r d 	 m e a n   p o o l i n g   i n s t e a d   o f   C L S   ( c l o s e   b u t   0 . 6 3 p p   w o r s e )  
 7 7 0 3 f a b 	 0 . 6 7 0 9 	 0 . 9 8 6 	 d i s c a r d 	 l e a r n a b l e   h y b r i d   C L S + m e a n   p o o l   w o r s e   t h a n   p u r e   C L S  
 e 2 6 6 e 1 b 	 0 . 6 5 5 7 	 0 . 9 2 7 	 d i s c a r d 	 1 2 L   b o t t l e n e c k   a t t n   i n n e r = 3 2   t o o   c r i p p l e d   e x t r a   l a y e r s   d o n t   c o m p e n s a t e  
 e 1 b c 0 d c 	 0 . 6 7 1 8 	 0 . 9 1 7 	 d i s c a r d 	 6 L   h i d d e n = 8 0   w i d e r   t o k e n s   f e w e r   l a y e r s   ( h i d d e n = 6 4   i s   s w e e t )  
 7 2 2 5 f b 3 	 0 . 6 7 3 7 	 0 . 9 8 6 	 d i s c a r d 	 r e v e r s e   l a y e r - w i s e   d r o p o u t   0 . 3 0 - > 0 . 1 5   w o r s e   u n i f o r m   o p t i m a l  
 d 5 1 3 0 2 0 	 0 . 6 7 9 6 	 0 . 9 8 6 	 d i s c a r d 	 s e e d = 4 2   - 0 . 4 6 p p   v s   u n s e e d e d   b a s e l i n e   0 . 6 8 4 2   ( v a r i a n c e   e x i s t s )  
 b 2 e 4 7 a f 	 0 . 6 7 1 8 	 0 . 9 8 6 	 d i s c a r d 	 s e e d = 0   - 1 . 2 4 p p   f r o m   u n s e e d e d   b a s e l i n e  
 6 2 e 6 5 b e 	 0 . 6 7 2 8 	 0 . 9 8 6 	 d i s c a r d 	 s e e d = 1 2 3   l o w e r   t h a n   u n s e e d e d   0 . 6 8 4 2  
 1 9 4 7 c 1 c 	 0 . 6 7 9 0 	 0 . 9 8 6 	 d i s c a r d 	 s e e d = 2 0 2 4  
 a 6 f 1 8 3 4 	 0 . 6 8 1 9 	 0 . 9 8 6 	 d i s c a r d 	 s e e d = 7   c l o s e s t   y e t   b u t   0 . 2 3 p p   b e l o w   b a s e l i n e  
 4 3 3 2 0 9 8 	 0 . 6 8 5 1 	 0 . 9 8 6 	 k e e p 	 s e e d = 1 1   + 0 . 0 9 p p   r e p r o d u c i b l e   n e w   b e s t   b e a t s   u n s e e d e d   b a s e l i n e  
 c e 0 5 2 7 7 	 0 . 6 7 4 0 	 0 . 9 8 6 	 d i s c a r d 	 s e e d = 3 1  
 b 5 f 5 6 9 9 	 0 . 6 7 4 2 	 0 . 9 8 6 	 d i s c a r d 	 s e e d = 9 9  
 2 6 3 7 2 9 9 	 0 . 6 7 2 1 	 0 . 9 8 6 	 d i s c a r d 	 s e e d = 3 1 4  
 7 1 f d f 0 f 	 0 . 6 6 7 3 	 0 . 9 8 6 	 d i s c a r d 	 s e e d = 1 7  
 9 9 c 4 2 5 4 	 0 . 6 8 2 0 	 0 . 9 8 6 	 d i s c a r d 	 s e e d = 1 3  
 b c a e 1 c d 	 0 . 6 7 0 1 	 0 . 9 8 6 	 d i s c a r d 	 s e e d = 2 3  
 a e 8 d f 4 3 	 0 . 6 6 9 2 	 0 . 9 8 6 	 d i s c a r d 	 s e e d = 3 7  
 